{
  "schema_version": "1.0.0",
  "task_id": "task.r5.close",
  "requested_by": "user",
  "intent": "Record the verified R-5 operational acceptance and the final R-3 through R-5 completion result, then close the single handoff checkpoint.",
  "actions": ["read", "create", "write", "validate", "close"],
  "phase": "close",
  "target_paths": [
    "docs/reports/2026-07-21_R-5_운영_인수_및_전체_완료_결과.md",
    "docs/agent/DOCUMENT_MAP.md",
    "SESSION_HANDOFF.md"
  ],
  "target_file_ids": [],
  "target_unit_ids": [],
  "target_record_ids": [],
  "target_record_kinds": [],
  "target_kinds": ["report", "router_registry", "current_state"],
  "output_audience": "user",
  "include_scopes": ["docs/reports", "docs/agent/DOCUMENT_MAP.md", "SESSION_HANDOFF.md"],
  "exclude_scopes": ["backup", "inputs", "outputs"],
  "task_tags": ["stage", "documentation", "user-facing", "validation", "close", "handoff", "closure"],
  "as_of": "2026-07-21T03:00:00+09:00",
  "context_budget": 24000,
  "write_payload_path": "context/payloads/r5_close.json"
}
