{
  "schema_version": "task-request-1.0.0",
  "task_id": "task.claude-report-filename.restore",
  "requested_by": "user",
  "intent": "Restore the Claude-authored independent cross-verification report to its original unprefixed filename so only Codex-authored reports use codex_.",
  "actions": [
    "read",
    "move",
    "validate",
    "close"
  ],
  "phase": "close",
  "target_paths": [
    "docs/reports/codex_2026-07-21_R0-R5_독립_교차검증_보고.md",
    "docs/reports/2026-07-21_R0-R5_독립_교차검증_보고.md"
  ],
  "target_file_ids": [],
  "target_unit_ids": [],
  "target_record_ids": [],
  "target_record_kinds": [],
  "target_kinds": [
    "report"
  ],
  "output_audience": "user",
  "include_scopes": [
    "docs/reports"
  ],
  "exclude_scopes": [
    "backup",
    "inputs",
    "outputs"
  ],
  "task_tags": [
    "documentation",
    "report",
    "lifecycle",
    "naming",
    "correction",
    "validation",
    "closure"
  ],
  "as_of": "2026-07-21T15:05:00+09:00",
  "context_budget": 4000,
  "write_payload_path": "context/payloads/claude_report_filename_restore.json"
}
