{
  "schema_version": "task-request-1.0.0",
  "task_id": "task.r0-r5.final-cross-validation",
  "requested_by": "user",
  "intent": "Cross-validate the Claude independent R0-through-R-5 report against the Codex scored review, approved design, commits, current implementation, and reproducible local evidence, then publish one final Korean cross-validation report.",
  "actions": [
    "read",
    "review",
    "validate",
    "create",
    "write",
    "close"
  ],
  "phase": "close",
  "target_paths": [
    "docs/reports/2026-07-21_R0-R5_독립_교차검증_보고.md",
    "docs/reports/2026-07-21_R0-R5_재검토_점수_분석.md",
    "docs/reports/2026-07-21_R0-R5_최종_교차검증_보고.md",
    "docs/reports/2026-07-20_R-1.1_지식_시스템_설계_보정.md",
    "docs/reports/2026-07-21_R-2B_기존_지식_코퍼스_이관_결과.md",
    "docs/reports/2026-07-21_R-3_resolver_writer_일반화_결과.md",
    "docs/reports/2026-07-21_R-4_검색_평가_결과.md",
    "docs/reports/2026-07-21_R-5_운영_인수_및_전체_완료_결과.md",
    "tools/context/context_system.py",
    "tools/runtime/run_python.ps1",
    "tools/runtime/run_python.cmd",
    "tests/context/test_context_system.py",
    "tests/context/test_python_runtime_launcher.py",
    "catalog/files.jsonl",
    "catalog/units.jsonl",
    "evaluation/retrieval/r4_queries.json",
    "evaluation/retrieval/r4_baseline_result.json",
    "evaluation/operations/r5_acceptance.json",
    "evaluation/operations/r5_acceptance_result.json",
    "docs/agent/DOCUMENT_MAP.md",
    "SESSION_HANDOFF.md"
  ],
  "target_file_ids": [],
  "target_unit_ids": [],
  "target_record_ids": [],
  "target_record_kinds": [],
  "target_kinds": [
    "report",
    "code",
    "script",
    "test",
    "catalog_projection",
    "evaluation",
    "router",
    "current-state"
  ],
  "output_audience": "user",
  "include_scopes": [
    "docs/reports",
    "docs/agent",
    "tools/context",
    "tools/runtime",
    "tests/context",
    "catalog",
    "evaluation",
    "context"
  ],
  "exclude_scopes": [
    "backup",
    "inputs",
    "outputs"
  ],
  "task_tags": [
    "review",
    "audit",
    "cross-validation",
    "scoring",
    "validation",
    "performance",
    "python",
    "runtime",
    "handoff",
    "closure"
  ],
  "as_of": "2026-07-21T14:10:00+09:00",
  "context_budget": 30000,
  "write_payload_path": "context/payloads/r0_r5_final_cross_validation.json"
}
