{
  "schema_version": "1.0.0",
  "task_id": "task.r2b.contract-alignment",
  "requested_by": "user",
  "intent": "Align the R-2B storage contract and closure evidence with the fully populated knowledge metadata discovered during final handoff audit.",
  "actions": ["write", "validate", "close"],
  "phase": "close",
  "target_paths": ["docs/agent/KNOWLEDGE_SYSTEM.md", "docs/reports/2026-07-21_R-2B_기존_지식_코퍼스_이관_결과.md", "SESSION_HANDOFF.md"],
  "target_file_ids": [],
  "target_unit_ids": [],
  "target_record_ids": [],
  "target_record_kinds": [],
  "target_kinds": ["technical_contract", "report", "current_state"],
  "output_audience": "agent",
  "include_scopes": ["docs/agent/KNOWLEDGE_SYSTEM.md", "docs/reports/2026-07-21_R-2B_기존_지식_코퍼스_이관_결과.md", "SESSION_HANDOFF.md"],
  "exclude_scopes": ["backup", "inputs", "outputs"],
  "task_tags": ["knowledge", "schema", "documentation", "report", "handoff", "validation", "close"],
  "as_of": "2026-07-21T01:40:00+09:00",
  "context_budget": 9000,
  "write_payload_path": "context/payloads/r2b_contract_alignment.json"
}
