{
  "schema_version": "task-request-1.0.0",
  "task_id": "task.python-runtime-resilience.cmd-write-v2",
  "requested_by": "user",
  "intent": "Add an execution-policy-independent CMD entrypoint for the validated Python launcher and align tests, governing guidance, provisional case evidence, and handoff before source registration.",
  "actions": ["read", "create", "write", "review", "validate", "close"],
  "phase": "write",
  "target_paths": [
    "tools/runtime/run_python.cmd",
    "tests/context/test_python_runtime_launcher.py",
    "rules/validation.md",
    "docs/agent/WORKFLOW.md",
    "knowledge/cases/case.project.python-runtime-path-resolution.md",
    "SESSION_HANDOFF.md"
  ],
  "target_file_ids": [],
  "target_unit_ids": [],
  "target_record_ids": [],
  "target_record_kinds": ["case"],
  "target_kinds": ["script", "test", "policy", "procedure", "case", "current-state"],
  "output_audience": "agent",
  "include_scopes": [],
  "exclude_scopes": ["backup", "inputs", "outputs"],
  "task_tags": ["python", "runtime", "validation", "failure", "case", "documentation", "handoff", "closure"],
  "as_of": "2026-07-21T09:52:40+09:00",
  "context_budget": 14000,
  "write_payload_path": "context/payloads/python_runtime_resilience_cmd_write.json"
}
