{
  "schema_version": "task-request-1.0.0",
  "task_id": "task.session-handoff-update-2026-07-22",
  "requested_by": "user",
  "intent": "Audit and update the single SESSION_HANDOFF.md so the next session can resume from the verified Commands 1-to-4 fulfillment result, current corpus and validation state, exact approval boundary, failure ledger, stale-guide warning, and first unstarted action without relying on chat memory.",
  "actions": [
    "read",
    "review",
    "validate"
  ],
  "phase": "plan",
  "target_paths": [
    "PROJECT_RULES.md",
    "AGENTS.md",
    "SESSION_HANDOFF.md",
    "docs/agent/DOCUMENT_MAP.md",
    "docs/agent/WORKFLOW.md",
    "README.md",
    "docs/user/GUIDE.md",
    "docs/reports/codex_2026-07-22_프로젝트_구조_분석_및_다음_작업_제안.md",
    "evaluation/retrieval/r4_baseline_result.json",
    "evaluation/operations/r5_acceptance_result.json",
    "knowledge/items.jsonl",
    "knowledge/decisions.jsonl",
    "knowledge/relations.jsonl",
    "knowledge/sources.jsonl",
    "records/work/events.jsonl"
  ],
  "target_file_ids": [],
  "target_unit_ids": [],
  "target_record_ids": [],
  "target_record_kinds": [],
  "target_kinds": [
    "policy",
    "router",
    "current-state",
    "procedure",
    "user-guide",
    "report",
    "evaluation-result",
    "knowledge-record",
    "decision-record",
    "relation-record",
    "source-record",
    "work-record"
  ],
  "output_audience": "user",
  "include_scopes": [
    "docs/agent",
    "docs/user",
    "docs/reports",
    "evaluation",
    "knowledge",
    "records"
  ],
  "exclude_scopes": [
    "backup",
    "inputs",
    "outputs"
  ],
  "task_tags": [
    "handoff",
    "session",
    "audit",
    "documentation",
    "validation",
    "closure",
    "commands-1-4"
  ],
  "as_of": "2026-07-22T00:00:00+09:00",
  "context_budget": 30000
}
