{
  "schema_version": "task-request-1.0.0",
  "task_id": "task.python-runtime-resilience.cleanup",
  "requested_by": "user",
  "intent": "Remove the failed atomic catalog-write temporary artifact after verifying its exact workspace path, then resynchronize catalogs.",
  "actions": ["read", "write", "validate"],
  "phase": "write",
  "target_paths": ["catalog/tmp373czc5g"],
  "target_file_ids": ["file.catalog.tmp373czc5g"],
  "target_unit_ids": [],
  "target_record_ids": [],
  "target_record_kinds": [],
  "target_kinds": ["project_file"],
  "output_audience": "agent",
  "include_scopes": [],
  "exclude_scopes": ["backup", "inputs", "outputs"],
  "task_tags": ["python", "runtime", "catalog", "cleanup", "validation"],
  "as_of": "2026-07-21T10:20:00+09:00",
  "context_budget": 4000
}
