{
  "schema_version": "task-request-1.0.0",
  "task_id": "task.claude.rename-session-reports",
  "requested_by": "user",
  "intent": "Rename only the two reports authored by the Claude session so their file names carry the claude author prefix, preserving stable file identity through a recorded move.",
  "actions": [
    "move"
  ],
  "phase": "close",
  "target_paths": [
    "docs/reports/codex_2026-07-21_R0-R5_독립_교차검증_보고.md",
    "docs/reports/codex_2026-07-21_R0-R5_점수_교차검증.md",
    "docs/reports/claude_2026-07-21_R0-R5_독립_교차검증_보고.md",
    "docs/reports/claude_2026-07-21_R0-R5_점수_교차검증.md"
  ],
  "target_file_ids": [],
  "target_unit_ids": [],
  "target_record_ids": [],
  "target_record_kinds": [],
  "target_kinds": [
    "report"
  ],
  "output_audience": "user",
  "include_scopes": [
    "docs/reports",
    "docs/agent"
  ],
  "exclude_scopes": [
    "backup",
    "inputs",
    "outputs"
  ],
  "task_tags": [
    "documentation",
    "move",
    "naming",
    "governance"
  ],
  "as_of": "2026-07-21T14:10:00+09:00",
  "context_budget": 20000,
  "write_payload_path": "context/payloads/claude_rename_session_reports.json"
}
