{
  "schema_version": "task-request-1.0.0",
  "task_id": "task.python-runtime-resilience.verified-close",
  "requested_by": "user",
  "intent": "Finalize the case and current handoff with the completed 29-test verification and explicit secondary-cleanup diagnostic coverage.",
  "actions": ["read", "write", "validate"],
  "phase": "close",
  "target_paths": [
    "knowledge/cases/case.project.python-runtime-path-resolution.md",
    "SESSION_HANDOFF.md"
  ],
  "target_file_ids": [],
  "target_unit_ids": [],
  "target_record_ids": ["case.project.python-runtime-path-resolution"],
  "target_record_kinds": [],
  "target_kinds": ["knowledge_case", "handoff"],
  "output_audience": "agent",
  "include_scopes": [],
  "exclude_scopes": ["backup", "inputs", "outputs"],
  "task_tags": ["python", "runtime", "case", "handoff", "validation", "close"],
  "as_of": "2026-07-21T11:20:00+09:00",
  "context_budget": 8000,
  "write_payload_path": "context/payloads/python_runtime_resilience_verified_close.json"
}
