{
  "schema_version": "task-request-1.0.0",
  "task_id": "task.commands-1-4-requirements-reanalysis",
  "requested_by": "user",
  "intent": "Reanalyze whether the user's final goal, common principles, and Commands 1 through 4 were fully satisfied, using the original Korean reports, approval chronology, current implementation, corpus coverage, and validation evidence; then correct the existing codex_ report and current checkpoint without implementing the missing project features.",
  "actions": [
    "read",
    "review",
    "validate"
  ],
  "phase": "plan",
  "target_paths": [
    "AGENTS.md",
    "PROJECT_RULES.md",
    "SESSION_HANDOFF.md",
    "README.md",
    "docs/agent/DOCUMENT_MAP.md",
    "docs/agent/WORKFLOW.md",
    "docs/agent/KNOWLEDGE_SYSTEM.md",
    "docs/agent/CONTEXT_RETRIEVAL.md",
    "docs/agent/KNOWLEDGE_MAINTENANCE.md",
    "docs/user/GUIDE.md",
    "docs/reports/2026-07-20_기존_프로젝트_분석.md",
    "docs/reports/2026-07-20_프로젝트_기반_및_지식_시스템_설계.md",
    "docs/reports/2026-07-20_프로젝트_기본_기반_구축.md",
    "docs/reports/2026-07-20_R-1_지식_시스템_설계_정정.md",
    "docs/reports/2026-07-20_R-1.1_지식_시스템_설계_보정.md",
    "docs/reports/2026-07-20_R-2_착수전_사용자_의도_정합성_검증.md",
    "docs/reports/2026-07-20_R-2A_컨텍스트_시스템_구현_결과.md",
    "docs/reports/2026-07-21_R-2B_기존_지식_코퍼스_이관_결과.md",
    "docs/reports/2026-07-21_R-3_resolver_writer_일반화_결과.md",
    "docs/reports/2026-07-21_R-4_검색_평가_결과.md",
    "docs/reports/2026-07-21_R-5_운영_인수_및_전체_완료_결과.md",
    "docs/reports/codex_2026-07-21_R0-R5_재검토_점수_분석.md",
    "records/sessions/session.2026-07-20.r1-r1.1-document-governance.md",
    "tools/context/context_system.py",
    "tests/context/test_context_system.py",
    "evaluation/retrieval/r4_baseline_result.json",
    "evaluation/operations/r5_acceptance_result.json",
    "knowledge/items.jsonl",
    "knowledge/decisions.jsonl",
    "knowledge/relations.jsonl",
    "knowledge/reviews.jsonl",
    "knowledge/revisions.jsonl",
    "knowledge/sources.jsonl",
    "records/work/events.jsonl"
  ],
  "target_file_ids": [],
  "target_unit_ids": [],
  "target_record_ids": [],
  "target_record_kinds": [],
  "target_kinds": [
    "router",
    "policy",
    "current-state",
    "user-guide",
    "procedure",
    "technical-contract",
    "code",
    "test",
    "evaluation-result",
    "report",
    "knowledge-record",
    "decision-record",
    "relation-record",
    "source-record",
    "review-record",
    "revision-record",
    "work-record",
    "session-record"
  ],
  "output_audience": "user",
  "include_scopes": [
    "docs/agent",
    "docs/user",
    "docs/reports",
    "tools",
    "tests",
    "schemas",
    "catalog",
    "context",
    "knowledge",
    "records",
    "evaluation"
  ],
  "exclude_scopes": [
    "backup",
    "inputs",
    "outputs"
  ],
  "task_tags": [
    "analysis",
    "review",
    "requirements",
    "commands-1-4",
    "approval",
    "knowledge-system",
    "rag",
    "report",
    "handoff",
    "validation"
  ],
  "as_of": "2026-07-22T00:00:00+09:00",
  "context_budget": 60000
}
