{
  "schema_version": "1.0.0",
  "task_id": "task.r2b.fixture.decision-evidence",
  "requested_by": "user",
  "intent": "Trace accepted decision D-14 through verified knowledge to its registered source locators without activating historical instructions.",
  "actions": ["read", "validate"],
  "phase": "read",
  "target_paths": [],
  "target_file_ids": [],
  "target_unit_ids": [],
  "target_record_ids": ["decision.r1.1.d14"],
  "target_record_kinds": ["decision", "knowledge", "source"],
  "target_kinds": ["decision_store", "knowledge_store", "source_store"],
  "output_audience": "agent",
  "include_scopes": ["knowledge"],
  "exclude_scopes": ["backup", "inputs", "outputs"],
  "task_tags": ["knowledge", "decision", "source", "relation", "retrieval", "validation"],
  "as_of": "2026-07-21T01:00:00+09:00",
  "context_budget": 8000
}
