{
  "schema_version": "task-request-1.0.0",
  "task_id": "task.project-structure-next-work-write",
  "requested_by": "user",
  "intent": "Publish the Codex-authored project structure analysis with the reconstructed L0-through-L8 resume gate, register its unique evidence route, and update the current handoff without implementing an L layer.",
  "actions": [
    "create",
    "write",
    "review",
    "validate",
    "close"
  ],
  "phase": "close",
  "target_paths": [
    "docs/reports/codex_2026-07-22_프로젝트_구조_분석_및_다음_작업_제안.md",
    "docs/agent/DOCUMENT_MAP.md",
    "SESSION_HANDOFF.md"
  ],
  "target_file_ids": [],
  "target_unit_ids": [],
  "target_record_ids": [],
  "target_record_kinds": [],
  "target_kinds": [
    "report",
    "router",
    "current-state"
  ],
  "output_audience": "user",
  "include_scopes": [
    "docs/reports",
    "docs/agent"
  ],
  "exclude_scopes": [
    "backup",
    "inputs",
    "outputs"
  ],
  "task_tags": [
    "write",
    "analysis",
    "review",
    "planning",
    "structure",
    "documentation",
    "report",
    "handoff",
    "validation",
    "roadmap",
    "pre-l",
    "closure"
  ],
  "as_of": "2026-07-22T00:00:00+09:00",
  "context_budget": 18000,
  "write_payload_path": "context/payloads/project_structure_next_work_analysis.json"
}
