{
  "schema_version": "1.0.0",
  "task_id": "task.r3.metadata-retrieval",
  "requested_by": "user",
  "intent": "Demonstrate deterministic R-3 metadata selection for the context implementation and verified context knowledge without broad search.",
  "actions": ["read", "validate"],
  "phase": "read",
  "target_paths": [],
  "target_file_ids": [],
  "target_unit_ids": [],
  "target_record_ids": [],
  "target_record_kinds": ["knowledge"],
  "target_kinds": ["code", "test"],
  "output_audience": "agent",
  "include_scopes": ["tools/context", "tests/context"],
  "exclude_scopes": ["backup", "inputs", "outputs"],
  "task_tags": ["retrieval", "context", "metadata", "validation"],
  "as_of": "2026-07-21T01:45:00+09:00",
  "context_budget": 12000,
  "metadata_filters": {
    "kinds": ["code", "test"],
    "statuses": ["active"],
    "task_tags": ["context"]
  },
  "record_filters": {
    "kinds": ["knowledge"],
    "statuses": ["verified"],
    "task_tags": ["context"],
    "retrieval_eligible": true
  }
}
