{
  "schema_version": "1.0.0",
  "task_id": "task.r2b.handoff-audit",
  "requested_by": "user",
  "intent": "Complete the R-2B handoff audit by adding explicit key terms, source inputs, and the exact resume checkpoint without changing the closed stage boundary.",
  "actions": ["write", "validate", "close"],
  "phase": "close",
  "target_paths": ["SESSION_HANDOFF.md"],
  "target_file_ids": [],
  "target_unit_ids": [],
  "target_record_ids": [],
  "target_record_kinds": [],
  "target_kinds": ["current_state"],
  "output_audience": "agent",
  "include_scopes": ["SESSION_HANDOFF.md"],
  "exclude_scopes": ["backup", "inputs", "outputs"],
  "task_tags": ["handoff", "validation", "close"],
  "as_of": "2026-07-21T01:30:00+09:00",
  "context_budget": 6000,
  "write_payload_path": "context/payloads/r2b_handoff_audit.json"
}
